# name: test/sql/delete/test_using_delete.test
# description: Test deletions with USING clause
# group: [delete]

statement ok
CREATE TABLE a(i INTEGER);

statement ok
INSERT INTO a VALUES (1), (2), (3);

query I
DELETE FROM a USING (values (1)) tbl(i) WHERE a.i=tbl.i;
----
1

query I
SELECT * FROM a;
----
2
3

# no condition?
query I
DELETE FROM a USING (values (1)) tbl(i);
----
2

query I
SELECT * FROM a;
----

statement ok
INSERT INTO a VALUES (1), (2), (3);

query I
SELECT * FROM a;
----
1
2
3

# multiple joins
query I
DELETE FROM a USING (values (1)) tbl(i), (values (1), (2)) tbl2(i) WHERE a.i=tbl.i AND a.i=tbl2.i;
----
1

query I
SELECT * FROM a;
----
2
3

# no matches
query I
DELETE FROM a USING (values (4)) tbl(i) WHERE a.i=tbl.i;
----
0

query I
SELECT * FROM a;
----
2
3

# self join
query I
DELETE FROM a USING a a2(i) WHERE a.i>a2.i;
----
1

query I
SELECT * FROM a;
----
2

# binding errors
# table does not exist
statement error
DELETE FROM a USING b WHERE a.i=b.i;
----
<REGEX>:.*Catalog Error.*does not exist.*

# column does not exist
statement error
DELETE FROM a USING a b WHERE a.i=b.j;
----
<REGEX>:.*Binder Error.*does not have a column.*

# DELETE ... USING must keep rowid and unique-index columns mapped after the USING join.
statement ok
CREATE TABLE delete_using_pk(id INT PRIMARY KEY, payload VARCHAR);

statement ok
INSERT INTO delete_using_pk SELECT range, range::VARCHAR FROM range(10);

query I
DELETE FROM delete_using_pk USING range(100) d(i) WHERE d.i = 0;
----
10

query I
SELECT count(*) FROM delete_using_pk;
----
0

statement ok
CREATE TABLE delete_using_pk_returning(id INT PRIMARY KEY, payload VARCHAR);

statement ok
INSERT INTO delete_using_pk_returning SELECT range, range::VARCHAR FROM range(10);

query II nosort
DELETE FROM delete_using_pk_returning USING range(100) d(i) RETURNING id, payload;
----
0	0
1	1
2	2
3	3
4	4
5	5
6	6
7	7
8	8
9	9

query I
SELECT count(*) FROM delete_using_pk_returning;
----
0
